class,tidy_tweet
1,مثال للبراءة قم الضعف قل الحيلة رغم التوكل الله أنقذوا انقذو انقذوا يس الل كاش النجم ٥٨ ال يك الق رآن راد لى القصص ٨٥ رده الله الى أحضان ذويه سالما كتب الخير
0,صارت معي كنت امشي را احد فجأه مسك برأيك جامد فكني الله بالغصب صرفتها المشكله ان هالبريك اللي سواه عشان شاف ساهر قدامه وقف يلبس الحزم شان ١٥٠ يعدمنا
1,الله يرحمها يارب حسبي الله الوكيل مدمن مخدرات ليششش تتتزوج
1,بطل الحفار عمي يخطف قلوب المغاربة رؤية دبي أبوظبي عجمان الطفل الطفل المغرب أنقذو
0,لازم تكون قويه عشان تتغلب الظروف الي تنسى شي اسمه خوف
1,فريق الإنقاذ تم جلب سيارة الإسعاف مدخل النفق للتأكد جاهزيتها لنقل الطفل بمجرد إخراجه انتشار أمني النفق سيارة الإسعاف استعدادا لخروج ريان أنقذو ريان
1,الله يرحمهم يغفر يسكنهم فسيح جناته يلهم أهلهم الصبر السلوان
1,انقدو انقذو ريان
1,عاجل فرق الإنقاذ تخرج الطفل يتم نقله بـ الإسعاف المستشفى أيام سقوطه بئر أنقذو ريان
1,ينقذه انقذ يونس بطن الحوت الله ادعو انقذو انقذو
1,الله خبر يحزززن الله يصبر امه يربط قلبها اللهم امين
0,نشرته لانك خايف يطلع مو صحيح تتم مهاجمتك انك متاكد بتنشره
1,ممكن اشوفه مباشر
1,الله يغفر يرحمهم يسكنهمالفردوس الأعلى عزي أهلهم ذويهم جميعا لله إليه راجعون
0,هقوله يسطا
1,انا اتابع الجزيره مباشر مافيه مطر عندهم
0,باقي نص متر ساعه لحد الان احتمال ساعات نص متر
0,يعني اذا ماعرفوا يتصادموا عاديهههه
1,إنالله إناإليه راجعون نسأل يجعله شفيعا لوالديه يلهمهم الصبر السلوان
0,اتمنى حكومة المغرب معاقبة صاحب البير لاهماله
1,الله يرحمه يجعله شفيع لوالديه
0,طيب ليش دخلوا الاطباء مضوا ساعات الخروج ليه تجهيز طائرة اخلاء كيلو الاسعاف ليه اساسا التكتيم
0,اي اساس قلت
0,اقتراح صحيح التحقيق سيكشف الحقائق
0,فعلا جاء بالنا التساؤلات الله مكتوب
1,يمكن بنشر احد الثاني اصطدم را بسبب السرعه
0,الفرق القتل حدا او قصاص
0,رجل إطفاء يتفقد جراح رجل مسن ضحايا انفجار هز البلاد نتيجة التخزين الآمن لمادة نيترات الأمونيوم شديدة الاشتعال المرفأ تقدر قوة الانفجار مس قنبلة الولد الصغير النووية تسبب بموجات تعادل زلزال بقوة ريختر الصور EPA
0,انفجارات انفجار استدعى الثورات المضادة انفجار استدعى دفع الجزية التسابق اليهود انفجار استدعى النسوية الدعارة الدياثة الإلحاد حرب الرويبضة انفجار فاستدعى الانتداب تصرف ماكرون بيروت أنها لاية فرنسية
1,يؤمن بالله اليوم الاخر فليقل خيرا او ليصمت رحمهم الله الهم اهلهم الصبر تقبلهم فيمن عنده الحمد لله حال
0,فيديو جديد متداول سوشيال ميديا يظهر لحظات مخيفة عاشتها عروس أخرى زوجها أثناء جلسة تصوير لحظة قوع انفجار انفجار انفجار الرؤية بيروت
0,فيديو انفجار يفسد فرحة عروسين لبنانيين لبنان انفجار PrayForLebanon prayforbeirut
1,اللهم كماحفظت عبدك رسولك يونس باطن الحوت احفظ ريان باطن الجب اعده لاهله سالمآ معافا انقذو كلنا
0,بدأت محاولات استغلال الكارثة خلال اعتبارها مدخل لجلب المساعدات فهل حو يفترض يكون رئيسا للجمهورية جريمة المرفأ مشروع إعادة إعمار يراد إنقاذ الطبقة السياسي النظام الاقتصادي اللبناني لبنان عهد ميشال انفجار
1,اذا انتهى العمر ماينفع الحذر الله يرحمها يصبر اهلها يجعلها شهدا الواجب
0,استقالت تريسي شمعون سفيرة لبنان الأردن الخميس الهواء احتجاجا منظومة الفساد نتائجها انفجار مسؤول لبناني يستقيل إثر الانفجار أعلن النائب مروان حمادة استقالته الثلاثاء استقالات مسؤولين عرب شيء نادر جدا لهذا تثير الفرح
1,الصحيح نقني الذنوب الخطايا ينقى الثوب الأبيض الدنس الله عز جل منزه نقيت الثوب الابيض الدنس العائدة لفض الجلالة
0,المخدرات اذا قف فتره ماتبين دمه حد علمي ممكن يوقف فترة يخلص الفحص يرجع الله اعلم المرض النفسي المفروض شي أساسي الفحص
0,أتاسف بشدة لعدم قدرة الوقاية انقاذ الطفل الان مرور ساعة الى بحيث نجد متطوعين الشعب يحاولون النزول اعطاء أفكار لانقاذ الطفل نتسائل أليس للوقاية المدنية طرق معدات لمتل المشاكل أنقذوا الطفل أنقذو
0,لبنان كانت تحتضر اليوم فارقت الحياة
0,شي ترتكب جرايئم المناهج المكرره ضياع ١٢ سنه الموضوعات لاسنه كلها اجازات بدون فايده الهدف حرمان تعذيب ليش عندهم اجازه طويله الي تدينه مليون يسددك بالمية لاتستفيد تخلص التوظيف النقل غيره غيره
0,ابي احط ذمتي شي اتوقع ان عشانهم أعلنوا فاته امس عشان القنوات الاعلام الدخل المالي
0,اي جهووووود يومين قادرين اخراج الطفل
0,بسبب شخص تدعي شعب ايش العقول المتحجر اللي عندك
0,دوله كامله لمده ٥ايام ماقدرو يطلعونه لحول قوه الا بالله الله يرحمه يغفرله يصبر اهله يارب
0,شدخل حريم يمديه طلع عفوا تعرفي تشغلي مكينة حفر او تتحكمي او جربتي تكوني مكانهم مكان خطر زي كلنا خايفين ماله دخل اذا حرمة او رجال
1,بمجرد ان نتخيل ان ريان ابن لواحد منا ندرك سبب تعاطف العالم بمثل المواقف انقذو أنقدوا
0,حزب الله الوصاية الفرنسية إسلوب الصدمة الترويع استخدم انفجار لإعادة القوى الوظيفية اللبنانية الطائفية لقمم الوصاية الغربية ذكرتهم بحدود أدوارهم المرسومة تأسيس نظام لبنان الطائفي
1,خلال ساعة الماضية اتابع بكل خوف عملية انقاذ الطفل ريان اسئل الله الرحمن الرحيم ان يخرجه سالم غانم معافا اللهم آمين انقذو كلنا
0,اتمنى عقوبة تصل الى المؤبد للتفحيط ترا بيموت اكثر مليون جنى لينا
1,اخبار كذب المصاب بحادث مستحيل يعطونه ماء لانه اذا عنده نزيف داخلي يتوفى طول ريان سقط ٣٢ متر تعرض لكسور الكل متيقن انه عنده نزيف داخلي مسألة انه عطوه ماء أكل تخدير اعلامي قت قوعه ماعطوه شي الله يرحمه يجعله شفيع لوالديه
0,اتوقع مات الاعلام تسترو الله يرحمه
0,الابل طلعت عليهم بطريق
1,شاهد ممرضة شجاعة تنقذ أطفال رضع بأعجوبة انفجار لبنان مرفأ
0,شاهد لبنانية تضرر منزلها انفجار تطالب بمحاسبة المسؤولين تقول حدا سائل فينا لبنان مرفأ
1,السعودية مصر الإمارات الجزائر ألمانيا روسيا فرنسا بريطانيا غيرها قائمة بدول سارعت لإغاثة لبنان الجريح نكبته بيروت مرفأ انفجار العربية
1,انا اليوم كنت عزاهم رحمهم الله لاني اعرفهم زملاء دراسه الاب صابر لله الحمد الابن الكبير اللي فقد لده اخوانه محتسب الاجر صابر سألته المصابين قال احد حولوه العلا الى تبوك الثاني انتظار طلب اخلاء طبي الى الرياض حالتهم مستقره كلها اقدار مكتوبه
0,بكرا يومك يجي يذمك تكون راضي هاذا اجبه عمله ماهو مجبور يرضيك مجبور يوقف ضدكك تنفيذ عملة تفتري علية الحق يزعل الباطل يفرح تبيه يسوي شي غصب تشمت الله يرحمهم يغفر انا اعرف احد نيتي طيبة الحمد لله
0,ليه تضحك لوح
1,طيب حي او
0,تعليق مشنقة ساحة كتعبير للمطالبة بمحاسبة تثبت ادانته بـ إنفجار ملحق لبنان بيروت انفجار
0,ممارسات حزب تضعه خانة المنظمة الإرهابية فق القانون الدولي التفاصيل رولا الخطيب لبنان انفجار
0,الوقائع المذكورة تدل بشكل قاطع فساد الدولة اللبنانية الملفت أنه يدري الجهة كانت تؤمن احتياجاتهم إنهم باعوا جزءا الوقود لتعيين محامي المشتري لأول كمية الباقي اشتراه مجهول قبض الثمن مين باع انفجار
0,السيد حسن التعاطي الدولي فرصة يجب يستغلها اللبنانيون يجب نبحث الفرص لدتها المأساة الميادين انفجار
0,الرابط الانفجار مخزن السلاح علاقة حزب الأسد بـ نيترات انفجار لبنان
0,الضفعه اللي مسوي معها مقابله فزع دق تلفون الله الدجاجه
0,رحمهم الله ماسمعت انهم متوجهين حائل الي تيماء لمعايده الدهم يمشون طلعت عليهم ابل سائبه تسببت بالحادث
0,شباب متل الورد الله يطمن قلب اهاليهن عليهنشو هالقهر هيدا مش مسموح يلي عم بصير مش مسموح الله ينتقم يلي السبب المشنقة قليلة عليهن انفجار انفجار كلكن
0,بالشرح المفصل الحدث تتحقق صحة مقاطع جرى تداولها لاستهداف مرفأ بصاروخ لبنان انفجار
0,هلق لنص ساعة جاي لحود رح يقول بدري قوات العونيي رح يصدقوا يعملوا هاشتاغ هلقد هني عونيي مرفأ انفجار
1,جسر جوي سعودي لمساعدة لبنان بتوجيهات الملك السعودية مرفأ انفجار العربية
0,مانن سائلين البشر بدن يسألوا حجر الشارع اللبناني يغلي قع انفجار
1,الله يرحمها أيام كورونا كانت الدراسة الله الناس الرتاحو الحوادث اليوم رجعت حضوري يوم يحصل حادث مضاربات الطلبة تفاحيط المدرسة ياليت الدراسة طوال الزمن مافية ناس تحسب المصايب الي تجي الدراسة الحضوري
1,جزاكم الله خير الجزاء الدارين قفتكم معانا محنتنا دعائكم المتواصل الله يبشرنا بفرحة خروجه عاجلا أجلا فعيوننا دمع يشهد الله قلوبنا موجوعة طفلنا الله يفرجها
0,رئيس الحزب التقدمي الاشتراكي ليد نثق بالجيش تصرفات السلطة تجعلنا نشك شيء نفضل تحقيقا لبنانيا دوليا مشتركا انفجار مرفأ بيروت انفجار العربية
0,معقول الدول شعوبها عندهم حديث الا صدمة انفجار معقول دول اوروبا شعوبها عم يفكروا بالشعب المتشرد بشوارع بيروت هيدا الصعلوك عم يهدد شاشات لبنان بالوقت اللي جثث اللبنانيين بعدها المباني شيطان جربوع
1,الي يقولون اعدام الولد ام تكن نيته القتل كانت نيته يفحط بسبب الاستهتار ماتو البنتين يصير الحكم قتل عمد يحكم بالقصاص
0,استدار حزب القرارات الدولية لزيادة ترسانته التفاصيل رولا الخطيب لبنان انفجار
0,شاهد فيديو لدخول المتظاهرين ساحة البرلمان قليل لبنان تظاهرات انفجار
0,بينما ينتظر خطابات الزعماء أحر الجمر أمهات ينتظرن عودة أبنائهن أحر الردم الأولية سائل إعلام لبنانية تمتنع بث خطابات السياسيين بيروت انفجار انفجار
1,صاحب السمو الشيخ تميم بن حمد يقدم حملة لبنان ليصل الإجمالي اللحظة مليون مازالت الأرقام تتزايد التغطية مستمرة تلفزيون انفجار بيروت لبنان انفجار انفجار
0,ثريد يقول الفليسوف الآشوري الساخر لوقيان البداية نصف شيئ السؤال نصف المعرفة نطرح الأسئلة لعلها تقودنا نصف المعرفة انفجار حزب
1,لقطات توثق معاناة الطفل قاع البئر انقذو ريان باقي
0,الله يرحمهم الوضع مريب
1,نفسي اعرف مات بالضبط مات الكسور النزيف الجوع العطش قدر الله شاء فعل الله يرحمه يجعله طير طيور الجنة
0,ححححسبي الله الوكييل كانوا يدرون العصر هدفهم
0,لاتقولي انا لدي امس يسال عنه يتابع معنا قلت طلعوه لأهله انه بخير الله يستر اصحابه مايقولو
0,قتيل آلاف جريح انفجار نصف المدينة شخص بلا مسكن يجب ضمان توزيع عادل منصف للمساعدات تطال الأكثر ضعفا
0,نداء الاستغاثة الاستعطاف الملك محمد السادس السلطات المغربية تأمر بإعادة عشرات المواطنات المواطنين المغاربة المقيمين العالقين لبنان المغرب محمد لبنان بيروت انفجار انفجار مرفأ دمار
1,نجل رئيس الوزراء اللبناني الأسبق رفيق يؤكد حزب الله يتحمل مسؤولية انفجار يطالب بلجنة تحقيق دولية بالواقعة لبنان PrayForLebanon prayforbeirut
0,انتظرها خطيبها بفستان الزفاف فعادت تابوت أبيض داع مؤثر للعاملة الدفاع المدني اللبناني سحر ضحايا انفجار
0,رئيس حزب حركة التغيير إيلي محفوض الدول الكبرى ستطلب إجراء تحقيق دولي انفجار مرفأ بيروت أجهزة الدولة اللبنانية موثوق لوقوعها سيطرة حزب انفجار العربية
0,الحرب الاهلية لبنان عام ميشيل عون يحلم بأن يكون رئيسا للبنان بأي سيلة بأي حال بأي ظروف بأي تنازل فتحالف عدوه اللدود حزب فحقق حلمه بشرط ان يكون رئيسا صوريا حسن نصر الله الرئيس الفعلي الضحية لبنان شعب لبنان انفجار انفجار
0,اذا جبت نيوك كود ١٦
0,تصريح صادم لأشهر خبير متفجرات إيطاليا انفجار ميناء أشبه بانفجار مستودع أسلحة ذخائر انفجار لبنان
0,كنت سيحصل ركبتها قبطان سفينة الصدفة حملت الموت ميناء بيروت يروي القصة أولها انفجار العربية
0,لكل حكم أخطاؤه تقصيره هيدا طبيعي مش طبيعي هيدي المعارضة عم تم ار بوج الرئيس فقط غيرو الاعلام الثوار تحميلو حدو المسؤولية انتو معارضة حقودة تخريبية تضليلية انتهازية تستغل جع الناس اخلاقية فاقدة للقيم بتسوو صرماية انتو ثورتكن الكذابة انفجار
1,عمره ١٤ شنو قصاص
0,شاهد رفض حكومة حزب إلغاء رحلة فرنسية محملة بطن نصف المساعدات لمتضرري انفجار لبنان مرفأ
0,ثائق حصلت عليها CNN تكشف صول شحنة طنا نترات بيروت متن سفينة مملوكة لـ روسيا عام شاهد بالفيديو انفجار
1,ربما عندما قال الد ريان أريد ابني حي ميت
0,عندما تم قصف مصافي النفط بالسعوديه أطلقوا الحملات الهاتشقات السعوديه خسرت السعوديه بتفلس الله عاب غيره ابتلى فابتلاهم الله بسوء الأحوال الاقتصاديه الافلاس الان ابتلاهم بتفحيرات لايعلمون عنها لاهم لاسادتهم بطهران اللهم لاشماته
0,شمس بيروت تغيب قتلتم انفجار
0,شاهد صور تعرض لـ انفجار لبنان مرفأ
0,استدار حزب القرارات الدولية لزيادة ترسانته التفاصيل رولا الخطيب لبنان انفجار
0,انفجار ثريد الجهود قادها الملك سلمان لدعم الانسان العربي المسلم الإنسانية طوال عاما توجها بإنشاء مركز فمنذ أمير للرياض انسانيته جسرا تعبر خلاله مشاعر السعوديين فكان صانع الافراح مضمد الجراح
0,كلمة نصرالله اليوم تؤكد ضرورة جود لجنة انفجار
0,بالمكانس العصي لبنانيون غاضبون يطردون زير التربية اللبناني طارق يطالبونه بالاستقاله لبنان انفجار مرفأ
1,أبرز تصريحات السيد حسن حول انفجار الميادين
0,قدرة القضاء اللبناني إجراء تحقيق موثوق شفاف مشكوك حالات موثقة عدم الالتزام بالقانون او الاستقلالية التحقيق انفجار يجب يكون مستقلا دوليا لبنان
0,رئيس الحزب التقدمي الاشتراكي ليد يصعب تصديق عدم معرفة حزب بشحنة نترات الأمونيوم الخطرة لماذا تنبه استخباراته السلطات اللبنانية انفجار العربية
0,الرفيق جو عقيقي شهيد آخر انفجار دم رح يروح هدر المسيح
1,ينقذه انقذ يونس بطن الحوت الله ادعو انقذو انقذو
0,التمثيل ببلش اول شي جه ضحوك ابتسامة عريضة للاعلام بكاء فحيش الطفلة استشهدت اليوم بسبب المجزرة الزعران مش عم بمثلوا الشعب عم بتاجروا بدم الضحايا تفوووو عليكم ثورة انفجار انفجار
0,لفت انتباهي زرت بيروت لافتات بصور زعماء مختلفين كتب عليها دولة الرئيس ركن شارع كثيرون دولة قليلون حكاما انفجار ذكرني فعلته جيسيندا أردرن رئيسة زراء نيوزلندا قعت مذبحة المسجدين ضحيتها عشرات المسلمين ضربت نموذجا
0,معلم توفي بحادث مروري ماحد درا عنه بسبت انكم مهتمين بالحريم
0,اميركا دعمت طالبان ضد الاتحاد السوفيتي قضت عليهم تفكيك الاتحاد السوفيتي انتهاء غايتها ايقاف دعم مليشيات الحشد الشعبي الارهابية القذرة قتلت هجرت خطفت سلبت نهبت العراق سوريا يعني بانها انتهت مهمتها سيكون انفجار النهاية
0,الملازم الأول الشهيد أيمن نور الدين الى مثواه الأخير بيروت بيروت لبنان مرفاء انفجار انفجار
0,فيديو السفير اللبناني المملكة لـ الإخبارية الأوضاع الإنسانية لبنان صعبة الأضرار الناجمة انفجار تتجاوز مليارات
0,احلى اه بالدني
0,سنوات نترات الأمونيوم المتفجرة مخزنة مرفأ بيروت إجراءات السلامة المناسبة مرة أخرى برهنت السلطات افتقارها أدنى احترام للقانون حياة الناس يجب المحاسبة انفجار لبنان
0,عماد خليل لينا علامة أصحاب فيديو تصوير انفجار مرفأ بيروت زاوية قريبة كانت مرته عم عماد فوت لجوه بعدها حدث الانفجار لينا عماد قيد الحياة المستشفى يتلقيان العلاج الحمدالله سلامتهم انفجار انفجار
0,زاره التعليم تستثمر اريح ولمعلمات القرى النائيه الهجر تبني بيوت دور احد تأجر الغرف المعلمات يكون حراسات امنيه معتمده المدارس يعني المعلمه تدفع الف شهريا للغرفه يكون الصاله مشتركة الحوش ممكن يوفرون مواصلات الكل ربحان
0,غازي العريضي السجن يناديلك انفجار انفجار
0,كاميرا توثق لحظات صادمة انفجار يقتحم زفافا الكنائس بالعاصمة المنكوبة لبنان مرفأ
0,الرئيس اللبناني يقول احتمالان لـ انفجار الأول الإهمال الثاني تدخل خارجي بواسطة صاروخ قنبلة
0,انا بدعي الفنانين النجوم الممثلين الزملاء المثقفين اللبنانيين الى النزول يوم السبت الساعة الضهر الى ساحة الشهداء ننزل كلنا سوا نتكاتف لبناء طن جديد إسقاط منظومة الفساد هيدا اجبنا طنا صوتنا اعلى اقوى لبنان لبنان انفجار
0,يتحدث حسن نصرالله كأنه الرئيس الفرنسي بأنه جاهز للمساعدة اجبك بكثير فواجبك الأصل تسلم سلاحك تفكك ميليشياتك تتحول مواطن عادي مثلك غيرك التبجح بتقديم المساعدة يحتاجها اللبنانيون منك أمثالك انفجار بيروت
0,جرائم ميليشيا حلفائها يغطيها سياسيين داخل لبنان اخرها انفجار تقع فق الاعراف الدولية خانة الارهاب المنظمة تمارس الارهاب الخارج فقط بالداخل اللبناني حماية حماية
1,أخ حارث الطراونة الف الحمد لله السلامة حارث أصيب انفجار بيروت تم نقلة طائرة سلاح الجو الاردن انفجار الاردن
0,يعقل دولها بكامل قواها عجزت بير مدري ليش السالفه مادخلت راسي شاء الله حاسبينها بالساعه يعني اول عارفين انه بيجلس ايام بيطلعونه ٨الليل المهم اذا فعلا الله يعين الولد يطلع سالم معافى ان شاء انه طيب دام اكله يجيه الاكسجين مدري ليش تذكرت صاروخ الصين
0,شلون تصادمو يعني شلون يعني احد طالع الغرفة الثاني جاي الصالة تصادم تقاطع المطبخ سيارة صدمة سيارة الله يرحمهم يغفر يسكنهم جنات النعيم يشافي مصابهم
0,ميا خليفة بكيت علبنان أكتر حكامه انفجار لبنان لبنان بيروت انفجار
0,لأن لبنان بلد شقيق غالي قلوبنا انفجار كسر قلوبنا أحزننا جميعا تاريخ يمحى الذاكرة الإنسانية ينساه فريق مجلتنا خوفا قلقا إليسا أهلنا أصدقائنا بيروت قلوبنا سلام بيروت ElissianMagazine
