class,tidy_tweet
1,الله يرحمها يغفر
1,الله يرحمها يغفر
1,الله يرحمها يغفر
0,الله يرحمها يغفر حطوا معلمه بمدينتها قريتها بيضركم لاحول قوة الا بالله
1,الله يرحمها يغفر يجبر مصاب اسرتها الكريمة
1,الله يرحمها يغفر يجعل مثواها الفردوس الأعلى الجنة يصبر أهلها ذويها يربط قلوبهم
0,الله يرحمها يغفر يجعلها اهل الفردوس الجنة مو معقوله اجي لهذي الدنيا مشكله المعلمات المعلمين انتهت الى الان الى زارة
1,الله يرحمها يغفر يسكنها الفردوس الأعلى الجنة انا لله انا اليه راجعون
1,الله يرحمها يغفر يسكنها فسيح جناته يلهم أهلها الصبر السلوان انا لله انا اليه راجعون
1,يرحمها يغفر يسكنها فسيح جناته يلهم أهلها ذويها الصبر السلوان لله إليه راجعون
1,الله يرحمها يغفر يسكنها فسيح جناته يلهم أهلها ذويها الصبر السلوان انا لله انا اليه راجعون
1,الله يرحمها يغفر يسكنها فسيح جناته يلهم أهلها ذويها الصبر السلوان انا لله انا اليه لراجعون
1,الله يرحمها يغفر يسكنها فسيح جناته يارب الموت ياتي القبر صندوق العمل
1,الله يرحمها يغفر يسكنها فسيح جنات النعيم ان يصبر قلوب أهلها ان لايريهم اي مكروه
1,الله يرحمها يغفرلها
1,الله يرحمها يغفرلها لايسامح حط النظام ليه حده تدرس منطقتها حرام اللي صاير
1,الله يرحمها يغفرلها يثبتها السؤال
1,الله يرحمها يغفرلها يدخلها الجنة حساب لاسابق عذاب امي موتى المسلمين
1,الله يرحمها يغفرلها ياناس الله السرعه التهور قصفت ارواح كثير ابرياء ماله ذنب
1,الله يرحمها يغمد روحها الجنة
1,الله يصبر اهلها الله يرحمها يغفر يسكنها فسيح جناته امين
1,الله يغفر يرحمها يسكنها فسيح جناته للامانه المعلمين المعلمات يقدمون هدايا لطلابهم
1,الله يغفر يرحمها يفرحها بلجنه مانوت تفرح طلابها لااعرفها حزنت عليها
1,اللهم اغفر ارحمها اسكنها فسيح جناتك يارب العالمين البقاء لله
1,اللهم اغفر ارحمها عافها اعف عنها برحمتك يارب العالمين
1,اللهم فرحتها لطلبتها هداياها عندك الله المقبولين المسرورين جناتك جنات النعيم
1,انا لله انا اليه راجعون غفر الله تجاوز عنها
1,انا لله انا اليه راجعون حول قوة الا بالله الله يرحمها يسكنها الفردوس الأعلى الجن يارب يلهم أهلها ذويها الصبر السلوان
1,انا لله انا اليه راجعون الله يرحمها يعفو عنها يجعل مثواها الفردوس الأعلى
1,انا لله انا اليه راجعون الله يخلف علي شبابها جعلها ربي اهل الجنه لاحول قوة الا بالله
0,حسبي الله شتت المعلمين المعلمات يصدر النقل
1,ربي يرحمها يغفر يسكنها الفردوس الأعلى الجنه الهم أهلها ذويها الصبر السلوان انا لله انا اليه راجعون احسن الله عزاءهم
1,رحمة الله عليها توفت لتادية رسالة العلم الجنه ان شاء الله
1,رحمة الله عليها رحمة اسعة الله يغفر يرحمها اللهم أسكنها الفردوس الأعلى الجنة اللهم آمين يارب العالمين
1,رحمة الله عليها اللهم إنها جادت بمالها تكرمت طالباتها فجد عليها بكرمك عفوك جنة عرضها كعرض السماء الأرض
1,رحمها الله رحمة الابرار والداي موتانا موتى المسلمين اللهم ارحمنا اذا صرنا الى ماصارو اليه
1,رحمها الله رحمة اسعة أسكنها فسيح جناته ألهم أهلها ذويها الصبر السلوان
1,رحمها الله غفر اسكنها فسيح جناته الهم اهلها ذويها الصبر السلوان شبابها جنات النعيم رب العالمين
1,رحمها الله أسكنها جنته عظم الله أجركم عوضكم خيرا عظيماا رحمها الله
1,رحمها الله غفر جنات النعيم دارها قرارها
0,عندما ترى رقة مكتوب عليها السائق التدريب اسبوع ينقل معلمات فالنتيجة كارثية
1,غفر الله اسكنها فسيح جناته الأبرار الصالحين موتى المسلمين
1,فاجعه حول قوه الا بالله الله يرحم غصون نجمي
1,حول قوة الا بالله لله إليه راجعون
1,حول قوة الا بالله الله يرحمها يغفرلها يسكنها فسيح جناته يلهم اهلها الصبر السلوان انا لله انا اليه راجعون
1,حول قوة الا بالله اللهم اغفر ارحمها اسكنها فسيح جناتك
1,لاحول قوة الا بالله الله يغفر يرحمها يسكنها فسيح جناته عظم الله اجر اهلها ذويها
1,لازم تقطعون قلوبنا بعرض الهدايا رسالة المعلمين معروفة بإذن الله إنها جنات النعيم تقلقوا تحزنوا
0,لمن يهمه الأمر راسلني
1,مؤلم انا لله انا اليه راجعون الله يرحمها يصبر أهلها
1,مافيه نقل خلاص كانت تسوق انتهى زمن النقل
1,نسأل الله يرحمها يغفر يسكنها فسيح جناته يلهم اهلها ذويها الصبر السلوان لله إليه راجعون
1,روحي الله يرحمها يغفر يسكنها الجنه بغير حساب لاعقاب
1,الله يرحمها يجعل الفردوس الاعلى مسكنها يعوض عليها شبابها بالجنه يصبر اهلها ذويها
1,رايحين يعايدون بأبوهم
1,قل خيرا او اصمت
1,لل الم اء الث الب الذ الخ اي الث الأ الدنس
0,مادري تبيه يحكم يعني انت جدك تبي تمشيها سلاح يعني زارة العمل ههههههههه قلت زارة العمل طيب الكفت يمشي القضاة الشيء الثاني قاعدة فقهية تبدي العرف المجاز كلمة سلاح مالها معنى معروف الا السلاح الناري او الابيض اما انك تقصد زارة العمل فهذا تصريف
1,الله يرحمهم
1,لاحول لاقوة الا بالله العلي العظيم رحمة الله عليهم الله يصبر أهلهم ينزل عليهم السكينة
1,رحمهم الله أسكنهم فسيح جناته موتى المسلمين نسأل الله ان يجبر قلوب الديهم اهلهم بالصبر
1,اللهم اغفر ارحمهم احسن نزلهم اسكنهم الفردوس الاعلى الجنة ألهم أسرهم الكرام محبيهم الصبر السلوان لله انا اليه راجعون
1,آنا لله انا اليه راجعون اللهم تغمدهم بواسع رحمتك تجاوز عنهم أسكنهم فسيح جناتك أحسن عزاء أسرتهم جميعا
1,لله إليه راجعون تلقينا ببالغ الأسى الحزن نبأ فاة رئيس محكمة حائل فضيلة الشيخ محمدالعنزي اخيه عبدالعزيز ابن اخيهمافأحسن الله عزاء الجميع عظم أجرذويهم جبرمصابهم اللهم اغفر ارحمهم أكرم نزلهم وسع مدخلهم أسكنهم فسيح جناتك أموات المسلمين لكل كتاب
1,لله إليه راجعون ربي يرحمهم يارب يشفي المصابين يلهم ذويهم الصبر السلوان
0,الخبر ناقص خرجت عليهم ابل فحاولوا يتفادونها فحدث تصادم السيارتين
1,السلام عليكم رحمة الله بركاته عظم الله أجر ذويهما احسن عزائهما اللهم اغفر ارحمهما اعف عنهما أنزلهما منازل الصديقين الشهداء الصالحين والدينا المسلمين اللهم أجر ذويهما مصيبتهم اخلف خيرا لله اليه راجعون اشف مرضاهم
1,الله يرحم مات منهم يعافي يشفي المصابين ياااااااارب
1,الله يرحمه يسكنه فسيح جناته الرجال ذكره طيب معروف عندنا الرجال اهل القران اسال الله ان يكون شفيعا قبره خلوا عنكم الكلام الي ماله داعي الموت حق علينا كلنا قاضي قاضي
1,الله يرحمه يارب انالله اناالية راجعون
1,الله يرحمهم يجعل الجنة دارهم أموات المسلمين جميعا الدنيا ماهي الا لحظات تمر كمرور السحاب يأتيك الأجل بسرعة البرق نسال الله الهداية العفو العافية
1,الله يرحمهم يشفي مصابهم يصبر اهلهم عيالهم انا لله انا اليه راجعون
1,الله يرحمهم يغفر
1,الله يرحمهم يغفر يسكنهم الجنه موتى المسلمين ان يجبر قلوبهم
1,الله يرحمهم يغفر يسكنهم فسيح جناته موتانا نسأل الله الشفاء للمصابين
1,الله يرحمهم يغفر يسكنهم فسيح جناته يشفي المصابين عظم الله اجر أهلهم ذويهم
1,الله يرحمهم يغفر يسكنهم فسيح جناته يلهم أهله ذويه الصبر السلوان انا لله انا اليه راجعون
1,الله يرحمهم يغفر يسكنهم فسيح جناته يلهم أهلهم الصبر السلوان انا لله انا اليه راجعون
1,الله يرحمهم يغفر يسكنهم فسيح جناته يلهم اهلهم الصبر السلوان انا لله انا اليه راجعون
1,الله يرحمهم يغفر يعوضهم الجنه نعيمها موتى المسلمين انا لله انا اليه راجعون
1,الله يرحمهم يغفرلهم
1,الله يرحمهم يغفرلهم يسكنهم فسيح جناته الله امين
1,الله يرحمهم يغفرلهم يصبر أهلهم يارب
1,الله يغفر يرحمه يسكنه فسيح جناته
1,الله يغفر رايحين صل بر خذ امانته ماهم يتقبل برهم الدهم يدخلهم باذن الله العزيز القدير الجنه بلا حساب سابقه عذاب
1,الله يغفر يرحمهم آمين
1,الله يغفر يرحمهم يسكنهم فسيح جناته اللي يتطنزون ترى الدنيا دوارة ادع بالرحمة الثبات السؤال الله يجبر اهاليهم بالصبر السلوان
1,اللهم ارحمهم جميعا اجعل مثواهم الجنه
1,اللهم اغفر ارحمهم اعفي عنهم اجعلها الشهداء اللهم ادخلهم جنات النعيم أشفي المصابين انت الشافي ياكريم
1,اللهم اغفر ارحمهما رحمه اسعه ألهم أهلهم ذويهم الصبر السلوان أربط قلب الديهم
1,اللهم اغفرلهم ارحمهم أسكنهم الفردوس الأعلى الجنة والدينا إخوتنا أحبتنا المسلمين أحسن عزاء أهلهم أولادهم محب يهم الله اإليه راجعون
1,اللهم ارحم الراحمين اكرم الاكرم الاكرمين اكرمهم برحمة اسعة لدنك ياعفو ياغفور اجمعنا والدينا المسلمين المسلمات جنات النعيم عظ الله اجر اهلهم ذويهم جبر مصابهم انا لله انا اليه راجعون
1,انا لله إليه راجعون
1,انا لله انا اليه راجعون الله يرحمهم يغفر يصبر اهلهم والدهم المصيبه فعلا حادث مؤلم مروع ياليت نحذر اخطار الطريق لاتتبدل الافراح الى اتراح احزان التزموا بقواعد السلامة المرورية لانعترض اقدار الله الحذر اجب اعقلها توكل
1,انا لله انا اليه راجعون الله يرحمهم يسكنهم فسيح جناته يلهم اهلهم ذويهم الصبر السلوان
1,انا لله انا اليه راجعون الله يرحمهم يغفرلهم يثبتهم يصبر اهلهم فراقهم يشفى المصابين
1,انا لله انا اليه راجعون الله يرحمهم يغفرلهم يشفي المصابين يصبر قلوب اهاليهم ذويهم
1,انالله انا اليه راجعون الله يرحمهم يغفر يسكنهم فسيح جناته يارب العالمين
1,ربما حسن خاتمة لانهم هدف اضح بر الدين صلة رحم عيد نسأل الله الجنة
1,رحم الله الموتى أسكنهم فسيح جناته ألهم ذويهم الصبر السلوان شفى الله المصابين
1,رحم الله مات منهم نسأل الله الشفاء العاجل للمصابين جبر الله مصاب أهلهم الهمهم الصبر السلوان انا لله انا اليه راجعون
1,رحمة الله عليهم جميعا ربي ينور قبورهم ليوم الدين
1,رحمهم الله
1,رحمهم الله جميعا نعرفهم نعرف اخبارهم أقدار الله تمضي الجميع الحذر الحذر الظلم الجور دعوة المظلوم أسعد الناس خفيف الحمل يظلم اكف تدعوا العزيز الجبار العدل فتكون النتائج مروعة اقصد احد انما مجرد نصيحة
1,رحمهم الله رحمة الأبرار اسكنهم الفردوس الأعلى الجنة عظم الله اجر أهلهم ذويهم الهمهم الصبر نسأله تعالى للمصابين الشفاء العاجل
1,رحمهم الله رحمة اسعة اسكنهم فسيح جناته الهم اهلهم ذويهم الصبر اجزل جميعا الاجر انا لله انا اليه راجعون
1,رحمهم الله اموات المسلمين فاجعة بايام العيد الحادث اخوه المصاب الاب اكبر اللهم اربط قلوب اهلهم ثبتهم اجزل الاجر المثوبة لله انا اليه راجعون
1,الله تتعدد الأسباب الموت احد اللهم أرحمهم ارحم موتي المسلمين المسلمات
1,الله الله جمعهم القدر الله لايفجع مسلم اغلى ماعنده
1,لأحول لاقوة الى بالله العظيم الله يرحمهم يسكنهم جنات النعيم اموات المسلمين يشفي المصابين ان شالله
1,لأحول لاقوه الا بالله الله يرحمهم يغفر يصبر اهاليهم
1,حول قوة الا بالله اللهم تقبلهم قبول حسن
1,حول لاقوة الابالله العلي العظيم أسأل الله يرحمهم يغفر يسكنهم فسيح جناته يلهم أهلهم الصبر السلوان
1,لاحول قوة الا بالله العلي العظيم رحمهم الله غفر الله
1,لاحول لاقوة إلابالله الله يرحم المتوفين يسكنهم جنته يشفي المصابين عاجلا يارب العالمين آمين إنالله إناإليه راجعون
0,الله اعلم ان يقودون السيارات شباب صغير السن عيد فرح ربما حصل منهم طيش بالقياده يحدث عاده مناسبات الفرح الله يرحمهم جميعا لايفجعنا احد يلهم أهلهم الصبر السلوان
1,يارب لطفك الله يرحمهم يتجاوز عنهم
1,ياسبحان القدر ياسبحان الله اما القدر بامر رب العالمين
1,اللهم آمين رب
1,الله يرحمهم يغفر يسكنهم فسيح جناته يلهم اهلهم ذويهم الصبر السلوان انا لله انا اليه راجعون
0,حسبي الله الوكيل للحين تدخل السعوديه مخدرات دمار الله يرحمها
0,المفروض يعاقب الجاني بعقوبة يسعون الارض فسادا
0,معليش ايش دخل المرور
0,طالعين يمشون
1,الله يربط قلبه يكشف ضر شقيقته
1,الله يجبر قلب الام فقدت المفروض اي بزر يمسك السياره ١٨ سنه يمسكون ابوه بقفاه السجن يسحبون منهم سياراتهم الرخصه عشان يتربون
1,الله يرحمهم يغفرلهم يشفي امهم يارب
1,الله يرحمهم الله يشفي أمهم يصبرها
1,الله يرحمهم يغفر يشفي الدتهم
1,الله يشفيها تقوم بالسلامه الله يرحم بناته يسكنهم فسيح جناتهم
0,حسبنا الله فيكم يامن تبلون الخلق انفسكم الله المستعان
1,حسبي الله الوكيل حول قوة الا بالله
0,حسبي الله الوكيل الى تعقلون خلاص اعقلوا هاذي ارواح الحمدلله الي فضلنا كثير خلقه
1,ربنا يرحمهم يشفي يصبر أمهم يربط علي قلبها
0,كنا نعذرهم نقول مافي فعاليات السعودية حرام الملل الحين شو عذرهم الاغبياء الحين
1,حول قوة الا بالله الله يكومها بالسلامة يجبر گلبها يصبرها هالفاجعة
1,حول قوة الا بالله الله يرحمهم يغفر يتغمد روحهم بالجنة يشفي امهم يارب
1,ظلم هاشتاڨات انقذو انقذو أنقذوا ظلم لماذا تتكلم حينها تقول انها ظلم لأطفال آخرين تتكلم العدالة الجهوية كتمت صوتك أطبقت فمك الدعم العالمي تلقاه أولائك الأطفال المذكورين الله يهدي خلق
1,انقذو اللهم شعور الآية فرددناه أمه تقر عينها تحزن
1,اللهم شعور الآية فرددناه أمه تقر عينها تحزن انقذو انقذو
1,بدات الشكوك تراود قلبي يحصل الطفل ارجو ان لايكون افكر صحيح انقذوا انقذوا انقذو
1,بمجرد ان نتخيل ان ريان ابن لواحد منا ندرك سبب تعاطف العالم بمثل المواقف انقذو أنقدوا
1,رب اللهم أخرجه البئر نجيت يونس بطن الحوت جعلت النار بردا سلاما ابراهيم رب انقذو
1,يارب أخرجت يونس بطن الحوت أخرج الملائكة البئر إنك شيء قدير قلوب انقذو
1,البقا براسك
1,صدقي للأسف مات
1,الله يرحمه يربط قلوب اهله
1,الى أرحم الأرحمين
1,لله إليه راجعون
0,اجزت رمضان
1,اسألك بالله
0,اعلام مغربي كذاب ثمثيل المشاهد
1,الله يرحمة يربط علي قلب الدي ريان يجعلة شفيع لاحول قوة الابالله العظيم
1,الله يرحمة يغفر يلهم أهله الصبر السلوان
1,الله يرحمه
1,الله يرحمـه
1,الله يرحمه برحمته يسكنه فسيح جناته يارب العالمين
1,الله يرحمه يغفر
1,الله يرحمه يجعله شفيع لأهله
1,الله يرحمه يصبر اهله اتقهرت كانه قطعة قلبي انا اعرفه الا محنته عزائي لاهله لاهل المغرب للعالم كله
1,الله يرحمه يصبر قلب الدايت عزاءنا
1,الله يرحمه يغفر
1,الله يرحمه يغفر الله يصبر اهله يارب
1,الله يرحمه يغفر حكمة الله ان امه تشوفه حي لدقايق معدودهما ينفع الكلام مين المتسبب مين مين ريان معد بيرجع قدر الله شاء فعل الله يجعله طير طيور الجنه الله أوجع قلوبنا الحزن الله يرحمهعظم الله أجركم يالشعب المغربي العالم العربي
1,الله يرحمه يغفر يسكنه فسيح جناته يجعل قبره روضة رياض الجنة
1,الله يرحمه يغفر يصبر الديه يلهمهم الصبر السلوان الله يجبر قلوبهم فراقه يارررب
1,الله يرحمه يغفرله
1,الله يرحمه يغفرله يجعله شفيع لوالديه
1,الله يرحمه يغفرله يصبر الديه
1,الله يرحمه ياارب
1,الله يرحمه يارب
1,الله يصبر اهله
1,الله يغفرله
1,الله يغفرله يجمعه الديه
1,اللهم اجعله طير طيور الجنة
1,ان شاء الله انه بالجنه شفيع للوالديه
1,انا لله انا اليه راجعون
1,انا لله انا اليه راجعون الله يرحمه يسكنه فسيح جناته الله يصبر اهله
1,انا لله انا اليه راجعون الله يرحمه يصبر الديه
1,انا لله انا اليه راجعون
1,اهخ ياربي لاحول لاقوه الا بالله
1,اوجعت قلوبنا كسرت خاطرنا فقدانك بكل معاني الفقدان
1,ايش
0,تكفوووون احد يكون صادقق
1,جد
1,حسييت يمه قللبي
1,خلاص الكلام ماينفع ربي كاتب يخلق لاتلومون كلهم ماقصرو الحمدلله حال ادعو أهله بصبر الثبات
1,رحمة الله
1,رحمك الله ياريان
0,قايلكم
1,مؤلمة الله
1,
1,إله الله الله يرحمه
1,إله الا الله
1,اله الا الله
1,اله الا الله ماامدانه نفرح
1,اله الا الله محمد رسول الله
1,اله الا الله يارب انك ترحمه أخخ ربي امداني استانست
1,حول لله لاقوة
1,حول قوة الا بالله
1,حول قوه الا بالله
1,حول لاقوة الابالله
1,توني مبشر امي انه ياقي حي
1,لاااااا
1,لاااااااااااااااا
1,لاحول قوة الا بالله
1,لاحول قوة الا بالله الله يربط قلوب الديه يجعله شفيع
1,لاحول قوه الا بالله
1,لاحول لاقوة الا بالله
1,لحول قوة الا بالله الله يرحمه يغفر
1,ملاك فى السما
1,ياحبيبي الله يرحمو
1,ياربي الله يصبر امه ابوه اما حظه طير طيور الجنه ان شاءالله ارتاح الدنيا المتعبه
1,ياقلبي
1,يالله
1,خرج لمة البئر الى نور الجن فاضت روحك الطاهرة السماء رب أرحم أهل الأرض يارب اربط قلب الديه
1,المغرب الطفل فاة تعازینا الحارة لذوي ریان حقیقتا لحظات مؤلمة جدا سلام الله علی ریان اتقبل جسمانه الحبیب
0,الحقيقة تابع فتح الرابط
1,أخخ ياربي قلبي جعني الله يرحمه يارب يصبر قلب اهله عيلته طير طيور الجنه معقول أيام قلوبنا معه ربنا كتبله يموت ياربي الله يرحمه يغفرله
1,ابشروا بان الله سيعوض اهله خير بركه ذريه الله اكرم الاكرمين ارحم الراحمين
1,السلام سيدي مولاي ياابا عبدالله الحسين السلام صبرت فنعم عقب الدار لايوم كيومك ياابا عبدالله الله يرحمك ريان يصبر اهلك بحق محمد ال محمد
0,الطفل ريان ذمة الله شاهد اللحظات الاخيرة للطفل ريان الطفل ريان فاة ريان
1,الله يرحمه
1,الله يرحمه ياريت تساعدو بالهاشتاج الخاص بطفل سوري أنقذوا save
0,تحدثوا الطفل السوري المخطوف يتم تعذبيه يوم جلد تعذيب
0,جاء الذكركم تنسو اطفال سوريا جاء الذكركم تنسو اطفال فلسطين بورما ربي يرحمو يصبر اهلو
1,جاء ليذكركم أنكم أمة احدة رحل
1,ربنا يجعله طيرآ طيور الجنة
1,رحمك الله خصل نفسك انت الثوب الأبيض بلا خطايا الدنيا الزائلة
1,رحمك الله ريان لقد ابكيتنا حزنا اللهم الهم الديه اسرته الصبر السلوان انا لله انا اليه راجعون
1,رحمه الله أدخله فسيح جناته لله إليه راجعون
