class,tidy_tweet
1,لاحول لاقوة الا بالله
1,لاحول لاقوة الا بالله الله يشافيهم يكون بعونهم يحميهم يرحم توفى فيهم
1,لاحول لاقوة الا بالله
1,لاحول لاقوة الا بالله يارب تشفيهم تعافيهم تحفظهم
1,لاحول لاقوة الا بالله الله يحفظ لبنان اهلها يحفظ طنا العربي الله شي مرعب محزن
1,لاحول لاقوة الابالله
1,لاحول لاقوه الابالله
0,لايحصى اللحظة اتمنى تنقلون الخبر باسلوب صحيح
1,لله يلطف فيهم
0,هلحين اشوف الاخبار مكان لاعرفنا نوع الانفجار السبب
1,اااو الله يكفينا
1,الله ألطف أرحم بالجميع
1,لطيف الله يستر الله يعظم اجرهم ياربي
1,لطيف الله يرحمهم
1,يارب الطف بيهم
1,يارب رحمتك
1,يارب سترك رضاك الجنه اللهم احفظ لبنان شر سوء لأ حول قوة بالله العلي العظيم
1,يارب عدى السنه دى خير يارب
1,يارب لطفك فيهم يارب شي مروع الله يحميهم يساعدهم يارب
1,يارب هون عليهم
1,يارررب لطفك عفوك
1,ياساتر رب الله يلطف
1,ياساتر يارب
1,يالطيف
1,يالطيف الطف بحالهم
1,يالطيف الطف
1,يالطيف الله يلطف فيهم
1,يالطيف يارب الطف شافي جرحاهم ارحم المتوفين
1,ياللطيف اللطف لاحول لاقوه الا بالله
1,يالله
1,يالله الله يرحمهم يشفي مرضاهم
1,يالله انك تلطف
1,يالله رحمتك
1,يالله ضاق صدري الله يرحمهم يلطف
1,يوهه الله خبر يضيق الصدر
1,يووه يارب احفظهم
0,الي بقبرص سمع الانفجار قوته
1,قوة الانفجار سرعة الصوت يتبعه الاثر فتصير كانها انفجارين
1,سترك يارب
0,الله انها طالبة لمحة قيام الساعة
1,رعب
1,اللهم لطيف نسألك اللطف فى جرت المقادير ألطف لطيف
1,ياستير يارب الله عونكم اشفى الله مرضاكم
1,يالله
0,قوة الانفجار رهيبه
1,الحمدالله السلامة للأهلنا لبنان الله يارب يحفظكم مكروه
1,لاحول لاقوة الا بالله
0,نتمنى ان المذيعة بخير
1,الله يشفيها رب
1,حول قوة الا بالله سترك بالناس يارب
1,So awful So sorry
0,سلامة ليها للبنان للبي سي
1,التفجير اللي حصل فاجعة تذهل العقول ألومه يستطيع احد منكم ان يفعل شئ الموقف الامر تعدى الواقع الله يحمي الاشقاء لبنان يرحم الشهداء يشفي المصابين ينتقم المجرمين
0,الحمد لله سلامتها
0,الحمد لله السلامة
1,الحمدلله السلامة ربي يحميكم
0,الحمدلله سلامتها
0,الصوت سكسي
1,الله حفظها الحمدلله الله عون أشقائنا لبنان
1,اللهم الطف بلبنان شعبها
0,المهم الله يستر تالي يعني سنه حافله هههههه
1,ان شاء الله تكون بخير
1,اوف
0,اوف اوف يالصوت
0,اول دول العربية قدمت مساعده فرنسا الكويت بعدها قدموا الدول العربيه الاولى الكويت
1,اويلي
1,تعزياتي لحضراتكم حادث بيروت الأليم الله معاكم يخفف عنكم التجربة الألم
1,حسبي الله الوكيل يارب ارحمنا يارب
1,حسبي الوكيل الي السبب الله الي مؤلم
1,خاصني نهرب
1,ربنا يكون معكم
1,رحم الله شهدائنا مرافا بيروت عبره نسبه للي جراى سوريا فلسطين اهل لبنان مدوا ايديهم بلخير سبيتهم اهنتهم مستقبلتهم صروتوا تتطعلو برامج تهينهم لان ارسلتوا دعوات اغاثه الدول العربيه لابت الاستنجاد دمتم بخير دامت بلادكم
1,سترك لطفك يارب
1,سلامات
0,سنه غريبه الله
1,طمنونا
0,عربية عربيا
0,قوع الانفجار تعد تتكلم عربي فصيح فقط الدارجة المغربية شئ غيرها
1,قلوبنا معكم
1,الله عون الشعب يجب يدركوا دولة قائمة طائفيه مليشيات حزبية مسلحة تنفع البلاد ابدا
0,كرمان السيد شي يهون لبنان حزباله
1,حول قوة بالله خالص التعازي لأهلنا بلبنان الشقيق
1,حول قوة الا بالله
1,لاحول قوة الا بالله العلي العظيم
1,لاحول لاقوة بالله
1,لحوووول الله
1,لطفك رب هادي صحافيه مغربيه طمنونا عليها
1,ليبياهيا البلد الوحيد العالم يعلم ستنام بيروت الليلة
1,مؤسف جدآ حالة مريم
0,مابين طرفة انتباهتها الله حال حال
1,مرعب جدا
1,معكى الله لبنان
1,مفجع جدا سلامات ماتشوفي شر
0,المسؤول القصف
1,نتمنى السلامة
1,اثر الانفجار اثر ايش بالزبط
1,بيروت كلها متفرجره لاحول قوة الا بالله
0,فيصل بخير
0,آمل انها يرام
1,الله الواخد جسمه قشعر الله يكون بالعون
1,الله منظر محزن جدا الله ينتقم السبب
0,المشهد الصادم
1,الله
1,ير
1,ياساتر
0,يالطيف
0,يالطيف كأني شفت ناس عندها يارب يكونون بخير
1,يمه قلبي
1,يمههه
1,تعزياتي لحضراتكم حادث بيروت الأليم الله معاكم يخفف عنكم التجربة الألم
1,انفجار النووي مو
0,تعرف القارئ
0,نووي ذبحهم كلهم
0,سؤالي
1,سترك لطفك يارب
1,ياربي سترك
1,اله الا الله انفجار جدا كبير الله يسلم اخواننا حول قوه الا بالله
1,يارب لطفك
1,حول قوة الا بالله
1,اعوذ بالله
1,ياسسسسسسساااتر يااااارب يكفيييناا الشر الله يحفظظهم
1,الله احفظ سويسرا العرب
1,لطيف
0,حسبنا الله الوكيل الله ينتقم سبب المجزرة
1,يالطيف
1,أوله
0,اتوقع ضربة اسرائيلية لمخازن أسلحة لحزب الله
1,استودعنا الله أهل لبنان
1,الله يحفظ لبنان شعبها
1,الله يحفظ يحمي اللبنانين
1,الله يحفظهم يشفي المصابين يعوضهم
1,الله يحمي الجميع يارب
1,الله يرحم الموتى يشافي الجرحى
1,الله يرحم الموتى يشفي الجرحى يلطف
1,الله يرحم حالهم يعوضهم مصيبتهم نحمد الله نشكره نعمه
1,الله يستر
1,الله يسلمك اهل لبنان دعواتي الله لايوفق اللي عمل
1,الله يكون بعونهم يارب محد تضرر
1,الله يلطف لاحول لاقوة الا بالله
1,الله يلطف يارب
1,الله يلطف فيهم
1,الله يلطف فيهم يارب
1,اللهم سلم اللهم سلم
1,المنظر يروع كنه قنبلة نوويه
1,اول مره حياتي اشوف منظر زي
0,ايش اعوذ بالله الشيطان الرجيم ياربي رحمتك
0,بدون شك أشياء خطيرة بداخله
1,بردا سلاما
1,بردا سلاما بيروت
1,حسبنا الله الوكيل اللهم الطف بحالهم
1,ربنا يسلم
1,عزه ياربي ارحمنه
1,كأنه انفجار نووي الله يسلم اهل بيروت
1,كارثة اللهم سلم
1,إله الا الله
1,إله الا الله ربي يلطف بيهم
1,اله الا الله
1,اله الا الله
1,اله الا الله يخوووف
1,حول قوة بالله الله يستر عليهم علينا شر
1,حول قوة الا بالله
1,حول قوة الا بالله الله يلطف فيهم
1,حول قوة الا بالله العلي العظيم
1,حول قوة الا بالله يارب تحفظهم حسبي الله الوكيل
1,حول قوة الاء بالله اللهم سلم سلم
1,حول قوة بالله شي مرررررررعب الله يكون عونهم رحمتك يالله بيهم
1,حول قوه الا بالله
1,حول قوه الا بالله الله بعونكم كارثه فعلا
1,لاحول قوة الا بالله
0,لاحول قوة الا بالله
1,لاحول قوة الا بالله الله يسلمهم شر خلقه أفعالهم
1,لاحول لاقوة الا بالله
1,لاحول لاقوة الابالله اول مره اشوف انفجار بهالصوره
1,لاحول لاقوه الابالله العلي العظيم حسبي الله الوكيل
0,ليش طيب يدمرون الناس اش يستفيد حسبي الله الوكيل
0,يقول حسن نصر الله
1,مخيف جدا
1,مخيف مرههه الله يجيرنا اهم شي مافيه فيات
1,منظر مرعب الله يستر الله يحفظ بلاد العرب
0,مين دخل خريطة السناب يشوف
1,نسال الله السلامة لاخواننا اللبنانيين
0,اللي ايران شهرين
1,ساتر
1,ساتررر
1,الله مرة يخوف الله يرحمهم يشفي مرضاهم
1,ساتر
1,ساتر يارب الله يشفي المصابين يرحم الي توفوا لاحول قوة الا بالله
1,سترك الله
1,ياااااا سااااااتتتترررر
1,يارب احفظهم
1,يارب تحفظ اهل لبنان تشفي مرضاهم ترحم ميتهم الانجار خطيييييييير
1,يارب رحمتك الله يلطف بحالهم
1,يارب عفوك
1,يارب لطفك
1,يارب نسالك السلامه لاهلنا لبنان
1,ياساااتر
1,ياساتر
1,ياساتر ياديني الله يحفظهم يارب
1,ياساتر يارب تحفظهم بحفظك
1,ياستااااار يارب
1,ياعمررييي
1,يالطيف الله يرحم ميتهم يشفي مصابهم
1,يالطيف الطف
1,يالطيف يارب
1,يالله
1,يالله
1,يالله سترك
1,يالله مخيف الله يحمي البنان اهلها يارب
1,يالله الله قلببي عورني اسوا شيء شفته اليوم لاحول لاقوة الا بالله
1,يالله
1,ياويللي
0,يقال معمل مفرقعات ناريه
1,يممممه حسبي الله الله يحميهم يلطف فيهم
1,يمه المباني تدمرت
1,يمه ياساتر
1,يمه يخوف مره الله يكون بعونهم
1,يوه حول قوة الا بالله
1,الله يغفر يرحمها
1,لله اليه راجعون رحمة الله عليها أسكنها الله فسيح جناته
1,الله يرحمك
1,الله يرحمه يسكنها فسيح جناته
1,الله يرحمها
1,الله يرحمها الاخبار تدمع العين
1,الله يرحمها يغفر يسكنها
1,الله يرحمها يسكنها فسيح جناته
1,الله يرحمها يعوضها بشبابها الجنة
1,الله يرحمها يغفر
1,الله يرحمها يغفر يصبر أهلها
1,الله يرحمها يغفر يسكنها الفردوس الأعلى الجن انا لله انا اليه راجعون
1,الله يرحمها يغفر يسكنها فسيح جناته موتى المسلمين آمين
1,الله يرحمها يغفر يسكنها فسيح جناته
1,الله يرحمها يغفر يسكنها فسيح جناته يصبر محبيها يارب
1,الله يرحمها يغفر يسكنها فسيح جناته
1,الله يرحمها يغفر يصبر محبيها يارب
1,الله يرحمها يغفر يارب
1,الله يرحمها يغفرلها
1,الله يرحمها يغفرلها يتقبلها الشهداء
1,الله يعوضها بالهدية العظمى الفردوس الاعلى
1,الله يغفر يرحمها يثبتها السؤال يسكنها الفردوس الأعلى الجنة والدينا موتى المسلمين
1,الله يغفر يرحمها يجعل بذلته ميزان حسناتها يجعلهع صديقين الشهدا
1,الله يغفر يرحمها يسكنها فسيح جناته لله إليه راجعون
1,الله يغفر يسكنها الفردوس الأعلى الجنه يجعل اليوم خير أيامها اسعدها
1,الله يغفرلها يرحمها يسكنها فسيح جناته
1,الله يلهم أهلها أحبابها الصبر السلوان
1,اللهم ارحمها اغفر اجعل قبرها روضه رياض الجنه
1,اللهم اغفر ارحمها
1,اللهم اغفر ارحمها عافها اعف عنها
1,ان لله ان اليه لراجعون
1,بجنات عرضها السموات الارض
0,خلو معلم او معلمه يشتغل مدينته ليه الشحططه شوله تجيبون حقين النوب لرياض حقين الرياض للجنوب بعدين قريه ناس متعلمين خلوهم يشتغلون هجرهم
1,رحمة الله عليها
1,رحمها الله رحمة اسعة
1,رحمها الله رحمة اسعه
1,رحمها الله غفر أسكنها فسيح جناته ألهم أهلها ذويها محبيها لله إليه راجعون
1,رحمها الله غفر تجاوز عنها
1,لاحول قوة بالله لله إليه راجعون الله يرحمها يغفر
1,لاحول قوة الا بالله الله يغفر يرحمها يسكنها فسيح جناته
1,لاحول قوة الا بالله الله يغفر يرحمها يسكنها فسيح جناته عظم الله اجر اهلها ذويها
1,رحمهم الله جميعا أسكنهم الفردوس الأعلى الجنة بوجهه العظيم جبر مصابنا مصاب أهلهم ذويهم فيهم
1,حول قوة الا بالله رحمهم الله غفر
1,الله يرحمهم
1,لله إليه راجعون حول قوه الا بالله الله مااعطا الله مأخذ الحادث تبريرات مالها معنا أدعوا بالرحمة المغفره
1,لله إليه راجعون اللهم افرغ أهلهم ذويهم رض يقينا اللهم اربط قلوبهم ارحم موتاهم ارزقهم الصبر السلوان
1,لله إليه راجعون حول قوة بالله الله يرحمهم يغفر يسكنهم فسيح جناته السميع العليم
1,لله إليه راجعون الله يغفر يرحمهم يتقبلهم بواسع رحمته يربط قلوب ذويهم بالصبر السلوان
1,لله إليه راجعون الله يرحمهم يغفر يشفي المصابين يمسح قلب الديهم أهلهم بالصبر الثبات يارب
1,لله إليه راجعون الله يغفر يرحمهم يجبر مصابهم يرحم امواتنا اموات المسلمين
1,لله إليه راجعوووون الله يرحمهم يغفر يسكنهم فسيح جناته يلهم أهلهم ذويهم الصبر السلوان
1,لله اليه راجعون الله يغفر يرحمهم يسكنهم فسيح جناته الله يصبر اهلهم يربط قلوبهم يشفي المصابين عاجلا آجل
1,إنالله إناإليه راجعون اللهم أغفر ارحمهم تجاوز عنهم عافهم اعفوعنهم شبتهم السؤال اشف مصابهم اللهم صل سلم نبينا محمد
1,الله يرحم مات يشفي المريض اشوف تعليقات تاويلات انزل الله سلطان لدرجة ان بعضهم إتهم احد الاخوان صدم اخوه عمدا حبيت اذكركم بحديث الرسول صلى الله سلم دعو الخلق للخالق اذكرو محاسن موتاكم
1,الله يرحمهم
1,الله يرحمهم برحمته الواسعة أسكنهم فسيح جناته يارب
1,الله يرحمهم جميعا يلهم اهلهم ذويهم الصبر السلوان
1,الله يرحمهم يسامحهم ياكثر ماوقع هالحوادث الاخوان طريق المدينه تيماء اخوان مصريين مسافرين احد تاخر الناني يشوف اخره تصادمو توفو الاثنين رمة الله عليهم اللهم الضن الحسن
1,الله يرحمهم يسكنهم الجنه يشفي لمصابين آمين
1,الله يرحمهم يسكنهم الفردوس الاعلى الجنه يجبر قلب ذويهم
1,الله يرحمهم يسكنهم فسيح جناته يلهم أهله ذويه الصبر السلوان
1,الله يرحمهم يشفي المصابين الله اعلم انهم يمشون جرى الحادث قصد بسبب جمال او شي تعرضو بالطريق
1,الله يرحمهم يغفر
1,الله يرحمهم يغفر يحسن اليهم يرزقهم الجنه يشفي المصابين
1,الله يرحمهم يغفر يسكنهم فسيح جناته أموات المسلمين
1,الله يرحمهم يغفر يسكنهم فسيح جناته يارب العالمين
1,ال ير مهم يغف يسڪنهم سيح ناته الله يربط قلوب أهلهم انا لله انا إليه راجعون
1,الله يرحمهم يغفر يشفي الباقين
1,الله يرحمهم يغفر يشفي المريض منهم
1,الله يرحمهم يغفر يصبر اهلهم
1,الله يرحمهم يغفرلهم يسكنهم الجنه الفردوس الأعلى الجنة امواتنا اموات المسلمين يارب عظم اجركم حسن الله عزكم
1,الله يغفر يرحمهم يحسن عزاء ذويهم
1,الله يغفر يرحمهم يسكنهم فسيح جناته
1,الله يغفر يرحمهم يشفي المصابين
1,الله يغفر يرحمهم يصبر اهلهم يشافي مريضهم
1,الله يغفرلهم يرحمهم يسكنهم فسيح جناته
1,اللهم أغفر تجاوز عنهما أكرم نزلهم أشفي مصابهم الهم اهلهم ذويهم الصبر السلوان
1,اللهم ارحمهم اغفرلهم عطرمشهدهم طيب مضجعهم اللهم أنس حشتهم ارحم غربتهم اللهم افسح قبورهم اجعلها روضه رياض الجنة انقلهم ضيق اللحود القبور الى سعةالدور القصورفي الفردوس الأعلى الجنة انعم الله عليهم الصديقين الشهداء الصالحين حسن رفيقا
1,اللهم اغفر لوالدينا والديكم والديهم للمؤمنين
1,اللهم اغفر أرحمهم شافي مرضاهم أربط قلوب أهليهم لاحول لاقوة بالله لله إليه راجعون
1,اللهم اغفر ارحمهم برحمتك اشفي مصابهم أهلهم
1,الميت مايجوز الرحمه دعو الخلق للخالق انتم بخير
1,انا لله اليه راجعون اللهم أغفر ارحمهم
1,انا لله انا اليه راجعون الله يرحمهم يغفرلهم
1,انا لله انا اليه راجعون الله يرحمهم اجعلهم اللهم الفردوس الأعلى
1,انا لله انا راجعون الله يرحم مات يشافي المصاب يعظم اجر ذويهم يحسن عزاهم
1,مافهمت انهم كانوا بسيارتين ماشين متجهين للمعايدة تصادموا حالة نادرة الله يرحم المتوفين يشفي المصابين
1,رحمه الله رحمة اسعة كريم الأخلاق مستنير الوجه رأيته تحبه سبب أسأل الله تعالى يصب رحماته يسكنه فسيح جناته
1,قال النووي مسلم مات فألهم الله الناس معظمهم الثناء دليلا أنه أهل الجنة سواء كانت أفعاله تقتضي تكن أفعاله تقتضيه تحتم العقوبة خطر المشيئة ألهم الله عز جل الناس الثناء دل الله شاء المغفرة
1,قدرالله شاء فعل الله يرحمهم جميعا يشفي الباقين
1,إله الله محمد رسول الله حول قوة الا بالله العلي العظيم لله إليه راجعون اللهم اغفر ارحمهم برحمتك أرحم الراحمين
1,حول قوة الا بالله الله يرحمهم يغفرلهم يلهم ذويهم الصبر السلوان
1,حول قوة الا بالله الله يرحمهم يغفر يسكنهم فسيح جناته
1,حول قوه الى بالله الله يرحم المتوفين يغفرلهم الله يشفي المصابين شفاء لايغادر سقما لأ نقول الا لله انا اليه راجعون اللهم امين يارب العالمين سلامتكم
1,لاحول لاقوة الا بالله الله يغفر للمتوفين يسكنهم فسيح جناته يشفي المصابين
1,لاحول لاقوة الا بالله العلي العظيم انا اليه راجعون اللهم ارحمهم اغفر أسكنهم الفردوس الأعلى الجنة ربط قلوب ذويهم
1,لاحول لاقوة الا بالله انا لله انا اليه راجعون الله يرحمهم يغفر يصلح ذريتهم عظم الله اجر ذويهم
1,لاحول لاقوة الابالله ان لله ان اليه راجعون
1,لله يرحمهما يغفرلهم يسكنهم جنات الفردوس الاعلى احسن الله عزاكم غفر الله المتوهم
1,اهل الجنه ان شاء الله
1,يمكن سكران
1,امين يوم الخميس الجمعة شهداء ان شاء الله الله يغفرلهم يرحمهم يصبر اهلهم امين
1,يالله رحمتك
0,الله المستعان الله يرحمهم يحسن اليهم لله انا اليه راجعون
0,يسال الحادث غرب اخوان السوال برى جدا لاخ ينكت احد طالع المقلط مدري يش تقابل تقاطع المطبخ مستهتر بقدر الله نتكلام يصف الحادث ليسى يسال جزاك الله خير صحصح
1,الفاتحة لارواحهم الطاهرة
0,الحد دية تقبل القصاص اذا تنازل أولالياء الدم بدية او لوجه الله يعفى القتل
0,قتل اعلان اي صنف انتي
1,لله إليه راجعون
1,الله يبلانا
1,الله يرحمها ليه صبرت
1,الله يرحمها يرحم اموات المسلمين
1,الله يرحمها يغفر حسبنا الله الوكيل
1,الله يعافينا لايبتلينا رحم الله الزوجة المغدورة زوجها فعذره اقبح ذنبه اتمنى ان تكون عقوبته حياة لآخرين بتوقفهم معاقرة المخدرات
1,حسبي الله
0,حسبي الله الوكيل احرقه الله دنيا آخره لجهنم يارب
0,ضروري شهادة الدكتور النفسي ارتباط
0,يعني يقتل حد
1,اله الا الله يارب رحمتتتك
1,حول قوة الا بالله
1,لاحول قوه الا بالله
1,لاحول لاقوة الا بالله العلي العظيم
1,لاحول لاقوه الابالله
0,لجهنم
0,مرض نفسي تعاطيه المخدرات مخدرات بدون نفسي حسبي الله الوكيل الحمدلله عافاني
1,الفايده الاخبار ضيقة الصدر
1,يارب لاتفجعنا
1,يمه بسم الله الله يبلانا
0,لابارك الله فيكم
0,شرها يفرق بينها اللي يشرب الخمر فنا بالك بمتعاطي مخدرات فتووووى
1,اللهم امين
0,لاحول قوه بالله ماتدرين أهلها الشخص نفسه قول الحمدلله دع الخلق للخالق
0,القصاص عقوبه بمثل فعله الجاني اما الحد عقوبه يجوز اسقاطها
0,ينقرضوا اذا طبق فيهم حد القصاص
0,صحيح
1,حرام يعدم صح الام مالها ذنب ربنا يرحم البنات الحادث سواه قاصر يعني مش بعقله اصلا الله يعينه طايش ممكن يتحاكم ١٥ ٢٠ سنة دفع فديه للاهل اكيد باشد الندم العشرين ممكن اقول عقله
0,القصاص القصاص
1,لله انا اليه راجعون حسبي الله الوكيل
1,الله يربط قلب امهم ابوهم
0,اللي تفحط حرمه
0,حسبي الله مستهتر ضايع
1,عصافير الجنة بااذن الله الله يشفيها يصبرها يارب لازم حدد للاستهتار
1,حول قوة الا بالله
1,لاحول قوة الا بالله
1,حرام الله يرحمهم
0,احسنت الراي فقت القول
0,لوحة رسمها رسام إطلالة المرفأ تبقى نافذة غرفة مريض مستشفيات بيروت إنفجار الجعيتاوي بيروت Beirut
0,التوقيت بيحكي شي كانت العالم المحللين السياسيين قالوها ناطرين عمل امني او عودة الاغتيالات قبيل موعد المحكمة اغتالو بيروت انفجار انفجار انفجار بيروت
