class,tidy_tweet
1,نجوى تستجيب طلب تضيء شمعة نية لشفاء المصابين انفجار
0,السيد حسن المواقف الأحكام المسبقة بشأن الفاجعة اعتمدت قلب الحقائق الميادين انفجار
1,جاء ليذكركم أنكم أمة احدة رحل لله إليه راجعون
1,اللهم انزل فيض لطفك جبرك علي قلوب ذويهم ارحم موتاهم اغفر ارحمهم رحمة السموات الارض مابينهما
0,قرر الإعلام عدم نقل كلمات الرؤساء القادة الزعماء طلب منهم الأفعال الأقوال أغلق الباب كلماتهم فتح المجال لأمهات الضحايا ليقولوا كلمتهم انفجار انفجار انفجار انفجار لبنان بيروت
1,اي الله يقطعون القلب زوجة اخوي قرية يارب تحفظها تحفظ بنتها بتنا شر يوم استودعهم ربي
1,تتواصل جهود فرق الانقاذ المغربية لانقاذ الطفل ريان اللهم فقهم الانقاذه اخرجهم جميعآ سالمين انقذو
1,الله يحفظ لبنان أهلها كلام الوكالة اللبنانية صحيح لأن الإنفجار بالساعات الأولى لحد الأن الله يرحم الميت منهم يشفي المصابين يلطف بحالهم
1,اللهم أخرج صغيرنا ريان ضيق البئر أخرجت يونس بطن الحوت ألهمه الصبر القوة ألهمت أيوب شق طريقا للنفاذ شققت البحر لموسى انقذو
1,سفير المملكة لبنان سفارة المملكة بدأت بإعداد خطة إنقاذ بداية الكارثة انفجار
1,فيات اصابتين عائله احده مصاب الله عون ذويهم الله يصبرهم الردود مدري قلوبها حجر او أطفال مستوعبين الفاجعه الي حلت عليهم جالسين يسئلون يحققون تفاهات الأمور ناسيين صلب الموضوع
1,خرج لمة البئر الى نور الجن اللهم عو طفولته جنان تفنى اجعله شفيعا لوالديه
1,اللهم يامجيب دعوة المظطرين يارحمن الدنيا الآخرة رحيمهما يامن انجيت يونس اخرجته ظلمات البحر بطن الحوت يامن انجيت يوسف غيابة الجب نجي ريان ظلمات البئر حيا سليما رده أهله سالما ارحم طفولته شيبة ابوه قلب أمه يارب لاإله إلاانت سبحانك اني كنت الظالمين
1,قوة أرتداد الأنفجار مرعبة الله يحفظهم بعينه اللتي تنام
0,حسبنا الله الوكيل السبب البلاء الدوله العربيه باسرها
1,لاحول لاقوة بالله الله يغفر لميتهم يرحمهم يشفي مريضهم يجبر قلوب اهلهم
1,حول قوة الا بالله اللهم الطف باخواننا لبنان احفظهم احرسهم بعينك تنام
1,الله ياربي الا كنا حنايا ناس بعاد قلبنا مزير ماقادرينش ننعسو الله قلب ماماه باباه ياااربي ترجع ليهم لدهم بخير أنقذوا أنقذو
1,لله الامر ان لله ان اليه راجعون
1,ندرك تمام أنه قدر الله ألم يع الأب فداحة اقترف البئر تغطية قس ربما نقترفه حق أنفسنا أهلينا كالقيادة بسرعة نحوها اللهم أهدنا لمافيه خير لمن نعول جنبنا الشرور مسلم اربط قلب الصغير نجه ارحم الراحمين
1,هيه تعتبر شهيدة ألواجب فهيا خرجت منزلها متجهة مقر عملها مثلها الجندي المعركة يعتبر مهمة لحظة تحركه معسكره ميدان المعركة اصيب الطريق أعتبرت إصابة عمل مات نتيجة حادث سير إستهداف العدو أعتبر شهيد إدارة مدرستها متابعة ذالك
1,لله إليه راجعون احسن الله عزاكم يااهلنا بالمغرب العربي الله عون الديه ربط قلوبهم رحمك الله ياريان جعلك الشفعاء لوالديك انا لله انا اليه راجعون
1,الله يرحمه يصبر اهله القلوب اسرت ريان يعرفونك ابتهلو بألسنتهم تعلقو بأسمك ايام فكيف بأهلك اقاربك انا لله انا اليه راجعون
1,لله إليه راجعون لله شئ عنده بأجل مسمى اللهم اغفر ارحمهم عاف اعف عنهم خارجين شهر فضيل سائرين أعظم أبواب البر الله أكبر
1,يالله تحطنا بللسان خالق الله ياناس حادث طبيعي اقدار مقدره الله سبحانه الواحد يكتفي بالدعاء بالصبر السلوان التأويل الدخول مصايب الناس التأليف اتقو الله يامسلمين
1,الله يرحمهم رب يسكنهم فسيح جناته لاقي الا شارع عام يفحط روح الصحراء طلع مهاراتك مو
1,الله يرحمه يجعل شفيع يربط قلب الدينه يخلفهم خيرا
1,خالص التعازي المواساة لأشقائنا لبنان حكومة شعبا جراء حادث الانفجار الأليم قع اليوم بالعاصمة اللبنانية بيروت داعيا المولى عز جل بالشفاء العاجل للجرحى يلهم أسر الضحايا الصبر السلوان
1,لل الم اء الث الب الذ الخ اي الث الأ الدنس فيات محمد
1,انا حاسة انها أية ربنا عشان العالم يشهد بعظمة خالق الخلق قادر حده ينقذ ريان تحيي تميت يامن جعلت أهل الكهف أية للناس أخرجه سالم غانم يارب العالمين أرحم الراحمين انقذوا انقذو
1,الله العالم يعرف فاته الطفل لحكمه لايعلم الا الله
1,شي مقدر مكتوب الفترة بالذات العيد تكثر فيهاالحوادث بسبب السهر لخبطة النوم السرعه عدم الانتباه الله يرحمهم يرحم اموات المسلمين
0,باقي حقها بتاخذها شخص ساهم زواجها بقائها هالمختل الله تجتمع الخصوم
1,كانوا يمهدوا للناس قبلها قالوا الولد خفت حركته ليتهم اخروا البيان يومين الله امداني اصرخ فرح الا التفت عاجل فاة الطفل
1,يارب ريان يصمد لوقت اخراجه يكون عايش
1,الله يرحمها يغفر يسكنها فسيح جناته يجعل قبرها روضة رياض الجنة يلهم اهلها ذويها الصبر السلوان انا لله انا اليه راجعون
0,رأيي الشخصي السجن لهاذا الشخص كافي ابدا قتل عمد بسبب التفحيط الاستهتار بأرواح البشر ارى بأنه يستحق القصاص ليكون عظه عبره لمن لايعتبر يقدر ارواح الله ان تكون ارواح بشر
0,هارت انسلاخ ثقافي انعدام شخصية
1,اللهم اربط قلوب ذويه الهمهم الصبر السلوان الثبات المصيبة يارب
0,مو معقولة طاح طفل بئر يجلسون ايام يحفرون تكون النتيجة مأساويه اتمنى يلقون حل لهذي الحوادث الله يرحمه يصبر اهله
1,تم ذكر ان ضعية الطفل تغيرت اصبح ظهره للكاميرا لايتحرك للاسف تلميح اضح لوفاته البارحة لاحول لاقوة الا بالله
0,فرددناه أمه تقر تحزن يارب الحمد
1,سبحانك ربي أعظمك أحن ألطفك سبحانه القائل فرددناه أمه تقر عينها تحزن
1,الله يحمينا يحميهم شر ربشكله مخزن ذخيرة تستبعد دامه منطقة صناعية قريب المساكن يكون لحزب الشيطان الله يمحيهم الارض هالمفسدين اتمنى يكون هالحادث المؤلم ضربة موجعة لابوالصواويخ نصراللات يجعل دماء الضحايا ذمته عنقه يوم الدينلاحول لاقوةالا بالله
1,اللهم احفظ الاسلام المسلمين لاخواني المسلمين بكل مكان اي دوله اي لون اخوه المحال ان نتمنى الهلاك الدمار لاحد اخذوا بعين الاعتبار ان اسرائيل لاتحاربكم بالسلاح فقط بدس الفتن بحسابات هميه
1,حسبنا الله الوكيل الله يحفظ لبنان أهلها مكروه انفجار
1,حول قوة الا بالله الله يشفيهم يرحم مات منهم يجبر مصاب اهلهم
1,الله يرحمها الله المعلمات يعانون المسافات الطويله هاذي نتايجها وزاره التعليم ملتزمين الصمت
1,المعلمة غصون رحمها الله اسكنها فسيح جناته كانت شهرها التاسع متبقي لادتها ايام بسيطه
1,رحمها الله غفر اسكنها فسيح جناته السؤال سيتم معاملتها معاملة اسرتها معاملة شهداء الواجب زارة السعودية
1,حول قوة الا بالله العلي العظيم الله يثبته السؤال جعلها جنات النعيم اللهم تفجعنا بأنفسنا أهلنا نعوذ مصائب الدنيا تقلب حوادثها المستغاث التوكل حول قوة الا بالله العلي العظيم يصبر أهله رب
1,موت بسبب حوادث السيارات اصبح اقل النصف السابق السبب الأنظمة المرورية وسائل الأمان قبلها ستر الله حفظه
0,اتق اللھ انت تظلم الناس ترحم عليهم خلي محقق كونان اللي داخلك يرقد
0,حدا يكون الحكم لله حدود الله رلايقبل التنازل قصاصا الحق لأهل الدم يقبل التنازل
0,الله يفقدة عافيته يرحم البنات يشفي الام
1,اللهم أخرجه سالما غانما معافى برحمتك ارحم الراحمين قر عيني الديه بعودته انقذو انقذو
1,اللهم معه يارب احفظه احميه رده اهله يارب سدد بقدرتك فريق الأنقاذ كلنا انقذو
1,الله باقي متر انقاذه يارب تمم بسلامته يرجع لاهله سالم غانم
1,ناس تتفلسف بالجهود المبذوله مساكين هذول سهرانين تعبانين يجي احد منسدح يقول باردين عفوا بالكم يلا بسرعه بسرعه نحفر ترا اي غلطه يطيح الطفل بعمق اكثر البئر ٦٠ متر طاح بالنص او تنهد التربه لازم بحرص ببطيء شديد اتركوا الفلسفه لأهلها الطفل
1,ليتهم اعلنو الحين ياخي شلون بننام امدنا نفرح بخروجه الا حزنا بوفاته
0,اللي تسويه الحين ذنب تتألي الله بالأحكام
1,لاحول قوة الا بالله العلي العظيم
1,لبنان الشقيقة الجميلة تهزم تموت ستقف بادن الله رجليها ستكون الأجمل أجمل السابق
1,الله يرحمها يغفرلها يجعل الفردوس الاعلى مسكنها الله توفت تركت الهدايا سيبقى اثر طيب قلوبهم اجمل حنية المعلمات الله يجزاهم خير يكتب الاجر تعبهم مجهودهم العظيم
1,اللهم أكرمها بطيب المقام حاولت إكرام طالباتها رحمها الله رحمة اسعة
1,لاحول لاقوة الا بالله انا لله انا اليه راجعون رحمها الله رحمة الابرار اسكنها الله فسيح الجنان جبر الله اهلها اقاربها صلة
1,الحمد لله اللذي عافانا ابتلاه اللهم تبتلينا بليته اعفو عنا ارحمنا ارحم الرحمين
0,لاحول قوة الا بالله اللهم ارحمهم برحمتك اسكنهم فسيح جناتك اشفي الدتهم اتمنى صاحب الحساب يسوي بلوك حق الحسابات المريضة اللي تقرا الخبر لاتحترم مشاعر الآخرين
1,إنقاذ ريان دراما إنسانية توحد العالم أنقذو ريان
1,اعتقد الخبر اصل لوالدينه كمان امه تصريحاتها الاخيره تسليم بالوفاه خاليه الامل ربط الله قلوبهم جبرها جبرا يليق بجلاله عظيم سلطانه
1,مخرج الحي الميت مخرج الميت الحي أخرجه أخرجت يوسف الجب رده لأمه رددت موسى لأمه أخرجه بطن البير أخرجت يونس بطن الحوت إنك شيء قدير
0,مكان ابار مكشوفه موب المغرب لابد احد عنده ابار مكشوفه يتقي الله ان يصيب اي كائن حي اي ضرر يتحملها طول عمره
1,بيروت لبنان اللهم سل اللهم سل
0,تتشمتووووون فيعافيهم الله يبتليكم خلوكم احسن منهم جانا منهم شي مكان الصالح الطالح الا المصايب تتشمتون
0,سلامات بيروت العالم يكفيه المآسي الموت
0,انت شايف التصوير جوالها اضح جدا لحظة الانفجار فا ينقطع النت المستهدف مو النت ياليت تكون اقعي
1,سيارات كانت تمشي مسافة قريبة جدا الإنفجار اكيد بشر حوله ياااارب ارحمهم سلمهم يارب
1,الله يغفر يرحمها ذهبت لمن ارحم الام برضيعها لمن خلقها عدم سبحانه
1,نتمنى تأخذ هدايا الرحمن يومها بالقبول دخول الجنة
0,المأساة المواجع سنة حنا نسمعها كانها اصبحت شي عادي المسلمات دور زارة النقل ليش مايكون مراقبة انظمة مستحدثه لسائقين الباصات تنظيمهم اللي صاير الاسف اهمال مهزلة لاتليق برؤية
1,لله إليه راجعون الله يرحمهم يغفر يسكنهم فسيح جناته يلهم أهلهم الصبر السلوان
0,تتكرر هالحوداث لسبب خلك راي ملحم خصوصا ايام الاجازات الافضل امشوا السرعه تكون معقوله الين توصلوا بالسلامه بخصوص الشيخ الله يرحمه أخوه مقدر مكتوب مجرد اسباب الجمال قطعت عليهم الطريق صدمموا رحمه الله عليهم
0,حسبي الله عليكم بسبب تهاون النظام للمعنف تجريم العنف
1,الله يرحمهم يجبر قلوب اهاليهم عشان اغلب متابعينك ياذا الحساب بزوره تافهين ماله داعي تنزل اخبار زي او الاقل تبلك اصحاب التعليقات المستهتره احترام لمشاعر اهل الخبر الناس اللي عندهم احساس
1,انقذو يبدو انه تم اخراج الطفل البئر نتمنى سماع اخبار طيبة
1,شعوب العالم الله يعين الدت والد ريان يلهمهم الصبر السلوان فقدانهم فلذة كبدهم ان يحسن الله عزائهم الطفل أنقذو أنقذو التحالف المغرب اليمن الجزائر الأمة
1,اللهم إني أسألك بإسمك الأعظم دعيت أجبت لت أعطيت أسألك بأسمائك الحسنى كلها علمت تخرج الطفل ريان البئر أخرجت يونس بطن الحوت انقذو
1,زملاء الطفل اليمني مهددون بالقصف طيران العدوان يحلق أجواء العاصمة صنعاء الطفل انقذو انقذوا
1,العالم بأكمله عالق الحفرة قلوبناء الطفل ريان الجنوب العربي انقذو
1,العالم المنافق الفرق الطفل ريان هاولا الاطفال لماذا نسمع نشاهد منكم هاذا التضامن هاذا الجرائم لاتهز فيكم شعره الله انه النفاق ان لاتساوي الطفوله تضم صوتك المظلومين المعتدى عليهم انقذو انقذو
1,رب الله يتلطف بالصبي الثلاثاء البئر شكرا لكل يعمل لانقاذه رب انقذو
0,انتقل ريان جوار رب كريم جهوا كاميراتكم قلوبكم أطفال اليمن سوريا العراق فلسطين انقذوا الأطفال يستحقون الحياة
0,إنالله اليه راجعون الله يرحمه كنت حاس انه ماراح يطول يوم ماجابوا خزانات قعدوا يقصون ليله كامله بالله شغل ناس يبون ينقذون شغل بدائي برود بطئ فيهم طبيعي شي يقهر صراحه
1,الله يرحمه حبيبي
1,الله يصبر اهله يعظم اجرهم يجعله فرطا شفيعا مجابا لوالديه
0,اي جسم يستحمل ايام الارض ابن سنوات إنقاذ بطئ جدا
1,جاء ليذك ركم أنكم أمة احدة رحل الطفل
1,ظلمة البئر لظلمة القبر الله يصبر اهله يرحمه
1,اضح انه ميت العصر الا يطلعونه يحجزونه بنفق ضيق سيارة الإسعاف جنبهم مجهزة
1,حشة المكان تفجع تذكرتها ابكي ربي اجل امه اش شعورها الله يعصم قلبها يلطف بحالهم يجعله شفيع لوالديه ياارب
0,تم الاعلان انه متوفي بالبئر لسبب فوضى الجمهور المتواجد لتهمت الحكومة انها تريد التخلص لتهمت بالتقاعس اربك العمل لااخراجه لاننسى ان الكميرا مسلطه يعرفوا قت فاته فاكملوا اخرجوه تاكدوا ١٠٠ اعل
1,ماقدر النعيم الحياة الكريمة الان ماهو حال الطفل اكمل ايام حفرة الحمدلله نعمك تعد تحصى الله يلطف أهله ينزل السكينه الطمأنينه
0,منزلين عمق البير جهاز استشعار يبين يوضح بوجود حرارة كائن حي الجهاز متوفر مركز دفاع مدني لمن انقطع جود الحرارة تبين فاته لمح المتحدث قتها حركته استجابته بطيئة بعدها تحدثوا لايعلمون حالته الله يجعله شفيعا لذويه
1,طفلنا كلنا الله هينا مجتمعين نتابع البث ندعي الله يخرجه سالم البئر اخرج يونس بطن الحوت
0,الله انهم مب طبيعيين شفتهم بالبث اقفين الحفره مب احد جمهور
1,الله يشفيهم شيء مريع
1,اللهم ارحم لبنان شعبها
1,انا لله انا اليه لراجعون
1,حول قوة الا بالله اللهم الطف
0,لبنان سرحة خنافس حزب الشيطان الى قذورات ايران كانت ايام الشهيد الحريري أوربا الشرق لان جعلتها ايران ذنابها خرابا دمار
0,يالله
0,اتمنى للاعلاميه مريم التومي ان تكون بالف خير سلامة لجميع العاملين قناتكم الكريمة نتمنى دوام التوفيق النجاح السلامة الدائمة
0,ليتك الله لاطم شحم
1,اوف اوف لااله الاالله الانفجار جا
1,الله يسكنها جنات النعيم
1,أسأل الله يرحمها الثناء عليها نسأل الله تكون عاجل بشرى المؤمن النية الطيبة انطوت عليها خبيئتها خلال حملها الهدايا للأطفال
1,الله يرحمها التهور يحصد الارواح قيادة المراة يجب تكون ضع قوانين صارمة للتهور لأنهن اول ضحايا التهور
1,الله يرحمها يسكنها فسيح جناته
1,الله يرحمها يسكنها الجنه توفيت تؤدي افضل اجب عليها التدريس للاطفال
1,الله يرحمها يغفر شي يحزن الظاهره متكرره بشكل كبير
1,الله يرحمها يغفرلها
1,انا لله انا اليه راجعون رحمه الله عليها اسكنها فسيح جناته اعرفها تركت خلفها فرحه لاطفالها رحلت اللهم جمعتها الدنيا اجمعها تحب جنات النعيم
1,انا لله انا اليه راجعون رحمه الله عليها اسكنها فسيح جناته اعرفها تركت خلفها فرحه لاطفالها رحلت اللهم جمعتها الدنيا اجمعها تحب جنات النعيم
1,ربي يفرحها بالفردوس الأعلى ماكانت تبغى تفرح طلابها اللهم صل محمد
1,لاحول قوة الا بالله قصة صديقتي سنوات الله يرحمهم يغفرلهم يجعل قبرها روضه رياض الجنه
1,لاحول لاقوة الا بالله الله يغفر يرحمهم
0,ياليت تعيد صياغة الخبر يليق بصحيفة انه تكتب خبر بركاكة
0,الله يرحمهم يجبر اهلهم مصابهم للايضاح التعليقاتالمذكوره ان الطريق عر جمال سائبة مقام ترحم دعاء مقام تندر بث شكوك عقيمة
1,الله يرحمهم يغفر يسكنهم فسيح جناته
1,غفر لله اسكنهم فسيح جناته يلهم أهله ذويه الصبر السلوان انا لله انا اليه راجعون الله يشفي مريضهم
0,بشر اتقوا الله تدخلوا بالنيات تظنوا بالناس ظن السوء تراهم اخوان اتقوا الله تكتبوا يقول احد السلف رأيت احد لحيته تقطر خمرا لقلت ربما انسكب جدته اقفا جبل يقول ربكم الأعلى لقلت لعله يقرأ الآية انا لله انا اليه راجعون رحمهم الله
1,الله يرحمها يكن راها رجال أهل يأخذون حقها ينقذوها فراحت ضحية
0,يجوا جماعة الخير يجمعوله الفدية
1,الطفل الحمدلله تم إخراج الطفل ريان داخل البئر داخل سيارة الإسعاف نتمنى السلامة للطفل الصبر السلوان لأهله حال انقذو
1,اخر لحظات انقاذ ريان دعواتكم ريان انقذو
1,أنقذو الطفل ریان أنقذو أنقذوا الطفل المغرب ريان
1,الجنة اجمل ياعصفور العالم قطع قلوبنا انام اصحى البث امل يطلع عايش قدر الله الحمدلله الله يربط قلب امه يصبرها فراقه
1,الله يرحمه يغفر يجعله شفيع لوالديه
1,اللهم اجعله طيور الجنه ثقل ميزان الديه اجعله شافعا حسناته انه حد الامه العربيه بالتعاطف معه كنا حاجه ماسه لتوحيد الصف العربي
1,شايله بناتي بقولهم يسألوني عنه الحمدلله قدر الله ماشاء فعل
0,ضيق المكان الخوف الظلام نقص الأكسجين الجوع العطش الأساس فرصه النجاه ضئيلة
1,مقدر شخص يولد مكتوب جبينه يموت ربي كاتبه اغلبكم يتحسب يجوز لان قضاء الله قدره
1,يالله قلبييي مش مصدقه الطفل مات الله يرحمه
0,الطفل يتوفي اليوم ايام هادا تضليل كاذب الاعلام يقولو انهم ارسلو ليه اكل شرب شي يدخل اي عقل ايام اول يوم ماحتي يقدر يرفع ايده يتحرك حركه طبيعيه
0,الشيئ المؤلم فاة الطفل فهو جنة النعيم مكان احسن يعبشه باليتني كنت مكانه المؤلم استهزاء الاعلام المغربي بمشاعر نفسية الديه طمعو انه حي الجميع بانتظاره الاعلام يكذب يقول ياكل يشرب لاباس لاندري مالغرض
1,خرج لمة البئر الى نور الجن طير طيور الجنة اللهم عو طفولته جنان تفنى اجعله شفيعا لوالديه انا لله انا اليه راجعون
1,رحمة الله ياطفلنا اللهم اجعله طير طيور الجنة يصبر اهله ذوية المسلمين اجمعين ريان
0,ماعتقد لازم تقول
0,العربيه قالت تم انعاشه مرتين انكروا الاعلام المغربي اهله شافوه الا ظهر الخميس انه بخير تكتم اعلام المغرب اضح
1,الله يرحمه يجعله طير طيور الجنة يجبر قلب الديه يصبرهم ياحي ياقيوم
